{
  "category": "watch",
  "dimensionsMm": {
    "depth": 12,
    "height": 48,
    "width": 42
  },
  "name": "Synthetic Watch Draft",
  "productId": "synthetic-watch",
  "schemaVersion": "1.0.0",
  "sourceNote": "Procedurally generated contract fixture; not a production scan or conversion.",
  "synthetic": true
}
