{
  "category": "nose_pin",
  "dimensionsMm": {
    "depth": 3.0,
    "height": 8.0,
    "width": 8.0
  },
  "name": "Heart Septum Nose Pin",
  "productId": "ingest-nose-pin-heart",
  "schemaVersion": "1.0.0",
  "sourceNote": "Optimized from Sketchfab-exported GLB placed in the mobile assets folder. Mesh scale is not millimetre-authored; dimensionsMm uses category-plausible draft values until measured.",
  "synthetic": false
}
